{
  "schema_version": "1.0",
  "units": { "length": "m", "unit_weight": "kN/m3", "diameter": "mm" },
  "metadata": { "project": "Harbor Terminal Wharf (synthetic example)", "site_name": "Berth 12", "boring_name": "B-3", "latitude": 33.74215, "longitude": -118.26541, "elevation": 3.2, "datum": "NAVD88", "start_date": "2019-06-11", "end_date": "2019-06-12", "boring_type": "Mud rotary", "rig": "CME-75", "diameter": 102, "hammer": "Automatic trip, 63.5 kg", "energy_ratio": 82, "logged_by": "J. Doe", "notes": "Synthetic boring for documentation." },
  "groundwater": [
    { "depth": 1.8, "date": "2019-06-11", "note": "encountered during drilling" }
  ],
  "layers": [
    { "top": 0, "bottom": 0.2, "description": "ASPHALT concrete, 200 mm" },
    { "top": 0.2, "bottom": 1.2, "description": "Aggregate base course, brown, dense, moist" },
    { "top": 1.2, "bottom": 4.5, "description": "Dark gray, loose, wet, silty SAND with shell fragments (HYDRAULIC FILL)", "uscs": "SM" },
    { "top": 4.5, "bottom": 6, "description": "Gray, soft, wet, lean CLAY with sand", "uscs": "CL" },
    { "top": 6, "bottom": 9.5, "description": "Gray-brown, medium dense, wet, poorly graded SAND with silt (SP-SM)" },
    { "top": 9.5, "bottom": 12, "description": "Olive gray, stiff, moist, fat CLAY" },
    { "top": 12, "bottom": 15, "description": "SANDSTONE, light brown, moderately weathered, weak" }
  ],
  "depth_notes": [
    { "depth": 7.6, "description": "thin clayey sand lens" }
  ],
  "samples": [
    {
      "top": 1.5,
      "bottom": 1.95,
      "name": "S-1",
      "type": "SPT",
      "blows": [2, 2, 2],
      "blow_count": 4,
      "specimens": [
        { "name": "S-1a", "top": 1.5, "bottom": 1.95, "water_content": 28.4, "fines_content": 22 }
      ]
    },
    {
      "top": 3,
      "bottom": 3.45,
      "name": "S-2",
      "type": "SPT",
      "blow_count": 6,
      "specimens": [
        { "name": "S-2a", "top": 3, "bottom": 3.45, "water_content": 31, "fines_content": 18, "nonplastic": true }
      ]
    },
    {
      "top": 4.6,
      "bottom": 5.2,
      "name": "T-3",
      "type": "Shelby",
      "remarks": "Sent for CU triaxial",
      "specimens": [
        { "name": "T-3a", "top": 4.65, "bottom": 4.8, "water_content": 38.2, "liquid_limit": 41, "plastic_limit": 19 },
        { "name": "T-3b", "top": 4.9, "bottom": 5.05, "water_content": 37.6, "dry_unit_weight": 13.1, "specific_gravity": 2.71, "remarks": "CU triaxial" }
      ],
      "recovery": 0.55
    },
    {
      "top": 6.5,
      "bottom": 6.95,
      "name": "S-4",
      "type": "SPT",
      "blow_count": 14,
      "specimens": [
        { "name": "S-4a", "top": 6.5, "bottom": 6.95, "water_content": 24.1, "fines_content": 9 }
      ]
    },
    {
      "top": 8,
      "bottom": 8.45,
      "name": "D-5",
      "type": "ModCal",
      "blow_count": 32,
      "sampler_diameter": 76,
      "specimens": [
        { "name": "D-5a", "top": 8, "bottom": 8.45, "water_content": 21.7, "dry_unit_weight": 16.4 }
      ]
    },
    {
      "top": 10,
      "bottom": 10.45,
      "name": "S-6",
      "type": "SPT",
      "blow_count": 11,
      "specimens": [
        { "name": "S-6a", "top": 10, "bottom": 10.45, "water_content": 42.3, "liquid_limit": 67, "plastic_limit": 26 }
      ]
    },
    { "top": 12.5, "bottom": 14, "name": "C-7", "type": "Core", "recovery": 1.3, "remarks": "RQD 45%" }
  ],
  "references": [
    { "text": "Example Geotechnical Consultants (2019). Geotechnical investigation report, Harbor Terminal Wharf." }
  ]
}
